{
  "$schema": "http://json-schema.org/draft-07/schema#",
  "$id": "coderso.smoke-evidence-manifest@v1",
  "title": "Smoke evidence manifest v1",
  "description": "Strict versioned envelope for durable runtime-smoke evidence, mirroring the TASK-545 manifest contract. The runtime validator in lib/smoke-evidence.mjs is the authoritative fail-closed implementation; this schema pins the declarative shape for owner review and force-track.",
  "type": "object",
  "additionalProperties": false,
  "required": ["schemaVersion", "taskId", "suiteId", "profile", "session", "report", "revision", "generatedAt", "serverUp", "scenarios"],
  "properties": {
    "schemaVersion": { "const": 1 },
    "taskId": { "type": "string", "pattern": "^(TASK-[0-9]{3}|TASK-9999)$" },
    "suiteId": { "type": "string", "pattern": "^[a-z0-9]+(?:-[a-z0-9]+)*$", "maxLength": 128 },
    "profile": { "enum": ["fast", "certification"] },
    "session": { "type": "string", "pattern": "^[a-z][a-z0-9-]{2,63}$" },
    "report": {
      "type": "object",
      "additionalProperties": false,
      "required": ["path", "sha256"],
      "properties": {
        "path": { "type": "string", "maxLength": 2048 },
        "sha256": { "type": "string", "pattern": "^[0-9a-f]{64}$" }
      }
    },
    "revision": {
      "type": "object",
      "additionalProperties": false,
      "required": ["gitHead", "workingTreeDirty", "workingTreeSha256"],
      "properties": {
        "gitHead": { "type": "string", "pattern": "^[0-9a-f]{40}$" },
        "workingTreeDirty": { "type": "boolean" },
        "workingTreeSha256": { "type": "string", "pattern": "^[0-9a-f]{64}$" }
      }
    },
    "generatedAt": { "type": "string", "pattern": "^\\d{4}-\\d{2}-\\d{2}T\\d{2}:\\d{2}:\\d{2}(?:\\.\\d{1,9})?Z$" },
    "serverUp": { "const": true },
    "scenarios": {
      "type": "array",
      "minItems": 5,
      "maxItems": 512,
      "items": {
        "type": "object",
        "additionalProperties": false,
        "required": ["id", "title", "variants", "screenshots"],
        "properties": {
          "id": { "type": "string", "pattern": "^[a-z0-9]+(?:-[a-z0-9]+)*$", "maxLength": 256 },
          "title": { "type": "string", "minLength": 1, "maxLength": 10000 },
          "variants": {
            "type": "array",
            "minItems": 1,
            "maxItems": 64,
            "items": {
              "type": "object",
              "additionalProperties": false,
              "required": ["id", "surface", "theme", "viewport", "assertions", "consoleErrors"],
              "properties": {
                "id": { "type": "string", "pattern": "^[a-z0-9]+(?:-[a-z0-9]+)*$", "maxLength": 256 },
                "surface": { "enum": ["admin", "public"] },
                "theme": { "enum": ["light", "dark"] },
                "viewport": {
                  "type": "object",
                  "additionalProperties": false,
                  "required": ["width", "height"],
                  "properties": {
                    "width": { "type": "integer", "minimum": 1, "maximum": 16384 },
                    "height": { "type": "integer", "minimum": 1, "maximum": 16384 }
                  }
                },
                "assertions": {
                  "type": "array",
                  "minItems": 1,
                  "maxItems": 256,
                  "items": {
                    "type": "object",
                    "additionalProperties": false,
                    "required": ["kind", "target", "property", "expected", "actual", "pass"],
                    "properties": {
                      "kind": { "enum": ["computed-style", "geometry", "dom-state", "aria"] },
                      "target": { "type": "string", "minLength": 1, "maxLength": 10000 },
                      "property": { "type": "string", "minLength": 1, "maxLength": 10000 },
                      "expected": { "type": "string", "minLength": 1, "maxLength": 10000 },
                      "actual": { "type": "string", "minLength": 1, "maxLength": 10000 },
                      "pass": { "const": true }
                    }
                  }
                },
                "consoleErrors": { "type": "array", "maxItems": 64 }
              }
            }
          },
          "screenshots": {
            "type": "array",
            "minItems": 1,
            "maxItems": 128,
            "items": {
              "type": "object",
              "additionalProperties": false,
              "required": ["path", "sha256"],
              "properties": {
                "path": { "type": "string", "maxLength": 2048 },
                "sha256": { "type": "string", "pattern": "^[0-9a-f]{64}$" }
              }
            }
          }
        }
      }
    }
  }
}
